<?xml version="1.0" encoding="utf-8" ?>
<xs:schema xmlns:xs="http://www.w3.org/2001/XMLSchema" elementFormDefault="qualified">
    <xs:element name="categories">
        <xs:complexType>
            <xs:sequence>
                <xs:element name="category" maxOccurs="unbounded">
                    <xs:complexType>
                        <xs:sequence>
                            <xs:element name="products">
                                <xs:complexType>
                                    <xs:sequence>
                                        <xs:element name="product" maxOccurs="unbounded">
                                            <xs:complexType>
                                                <xs:sequence>
                                                    <xs:element name="name" type="xs:string"/>
                                                    <xs:element name="price">
                                                        <xs:complexType>
                                                            <xs:sequence>
                                                                <xs:element name="currency" type="xs:string"/>
                                                                <xs:element name="amount" type="xs:decimal"/>
                                                            </xs:sequence>
                                                        </xs:complexType>
                                                    </xs:element>
                                                    <xs:element name="availability" type="xs:positiveInteger"/>
                                                    <xs:element name="onSales" type="xs:string"/>
                                                    <xs:element name="recommended">
                                                        <xs:complexType>
                                                            <xs:attribute name="value" type="xs:boolean" use="required"/>
                                                        </xs:complexType>
                                                    </xs:element>
                                                </xs:sequence>
                                            </xs:complexType>
                                        </xs:element>
                                    </xs:sequence>
                                </xs:complexType>
                            </xs:element>
                        </xs:sequence>
                        <xs:attribute name="type" type="xs:string" use="required"/>
                    </xs:complexType>
                </xs:element>
            </xs:sequence>
        </xs:complexType>
    </xs:element>
</xs:schema>